{
  "$schema": "http://json-schema.org/draft-07/schema",
  "type": "object",
  "properties": {
    "$type": {
      "type": "string"
    },
    "timestamp": {
      "type": "number"
    },
    "orderId": {
      "type": "string"
    },
    "userId": {
      "type": "string"
    },
    "storeId": {
      "type": "string"
    },
    "items": {
      "type": "array",
      "items": {
        "type": "object",
        "properties": {
          "sku": {
            "type": "string"
          },
          "quantity": {
            "type": "integer"
          },
          "quotedPrice": {
            "type": ["number", "null"]
          },
          "price": {
            "type": ["number", "null"]
          }
        },
        "required": ["sku", "quantity"]
      }
    },
    "tax": {
      "type": ["number", "null"]
    },
    "user": {
      "type": ["object", "null"]
    },
    "store": {
      "type": ["object", "null"]
    }
  },
  "required": [
    "$type",
    "timestamp",
    "orderId",
    "userId",
    "storeId",
    "items"
  ]
}